slug,publication,url,title,publishedAt
ackee-bamboo-jamaican-cuisine-beverlywood,Eater LA,https://la.eater.com/maps/best-jamaican-restaurants-los-angeles,Best Jamaican Restaurants in Los Angeles,2024-01-15
as-de-guia-gastrofonda-zona-centro,Eater LA,https://la.eater.com/maps/best-mexican-restaurants-los-angeles,Best Mexican Restaurants in Los Angeles,2024-02-01
fish-n-beer,Eater LA,https://la.eater.com/maps/best-seafood-restaurants-los-angeles,Best Seafood in Los Angeles,2024-01-20
la-pergoletta-restaurant-and-deli,Eater LA,https://la.eater.com/maps/best-italian-restaurants-los-angeles,Best Italian Restaurants in Los Angeles,2024-02-10
la-pergoletta-on-sunset,Eater LA,https://la.eater.com/maps/best-italian-restaurants-los-angeles-sunset,La Pergoletta on Sunset,2024-02-10
lamonica-s-ny-pizza,Eater LA,https://la.eater.com/maps/best-pizza-los-angeles,Best Pizza in Los Angeles,2024-01-25
osteria-marco,Eater LA,https://la.eater.com/2023/11/15/marco-polo-los-angeles,Marco Polo Trattoria in Los Angeles,2023-11-15
master-burger,Eater LA,https://la.eater.com/maps/best-burgers-los-angeles,Best Burgers in Los Angeles,2024-01-18
maury-s,Eater LA,https://la.eater.com/2023/10/24/maurys-restaurant-hollywood,Maury's Hollywood Restaurant,2023-10-24
meals-by-genet,Eater LA,https://la.eater.com/maps/best-ethiopian-restaurants-los-angeles,Best Ethiopian Food in Los Angeles,2024-01-12
mian-west-adams-los-angeles,Eater LA,https://la.eater.com/2023/12/05/mian-west-adams-chinese,MIAN West Adams Chinese Restaurant,2023-12-05
mignon,Eater LA,https://la.eater.com/2024/01/22/mignon-restaurant-los-angeles,Mignon Restaurant Opens in LA,2024-01-22
mikaza-nikkei-sushi,Eater LA,https://la.eater.com/maps/best-sushi-los-angeles,Best Sushi in Los Angeles,2024-02-05
mizlala-west-adams-los-angeles,Eater LA,https://la.eater.com/2023/09/19/mizlala-west-adams,Mizlala Brings Israeli Cuisine to West Adams,2023-09-19
mori-sushi,Eater LA,https://la.eater.com/maps/best-sushi-restaurants-los-angeles-mori,Mori Sushi Los Angeles,2024-01-30
myungin-dumplings,Eater LA,https://la.eater.com/maps/best-dumplings-los-angeles,Best Dumplings in Los Angeles,2024-01-28
nick-s-cafe,Eater LA,https://la.eater.com/2023/08/15/nicks-cafe-chinatown-los-angeles,Nick's Cafe Chinatown Institution,2023-08-15
nitethyme-wine-bar,Eater LA,https://la.eater.com/2024/02-08/nitethyme-wine-bar-beverly-grove,NiteThyme Wine Bar Opens in Beverly Grove,2024-02-08
now-serving,Eater LA,https://la.eater.com/2023/11/28/now-serving-restaurant-los-angeles,Now Serving Restaurant LA,2023-11-28
restaurant-olivia,Eater LA,https://la.eater.com/2023/07/25/olivia-restaurant-koreatown,Olivia Restaurant Koreatown,2023-07-25
ora-south-los-angeles,Eater LA,https://la.eater.com/2023/10/17/ora-south-los-angeles-restaurant,ORA South Los Angeles Opens,2023-10-17
oriel-chinatown,Eater LA,https://la.eater.com/2023/12/12/oriel-chinatown-los-angeles,Oriel Opens in Chinatown,2023-12-12
palmeri-ristorante,Eater LA,https://la.eater.com/maps/best-italian-restaurants-los-angeles-palmeri,Palmeri Ristorante Los Angeles,2024-01-15
peking-tavern,Eater LA,https://la.eater.com/2023/09/26/peking-tavern-los-angeles,Peking Tavern Chinese Restaurant,2023-09-26
petite-peso,Eater LA,https://la.eater.com/2023/11/07/petite-peso-los-angeles,Petite Peso Opens in LA,2023-11-07
pinky-s-los-feliz,Eater LA,https://la.eater.com/2023/08/29/pinkys-los-feliz-hot-dog,Pinky's Hot Dogs in Los Feliz,2023-08-29
common-wave-hifi,Eater LA,https://la.eater.com/2024-01-16/common-wave-hifi-record-shop,Common Wave HiFi Record Shop & Cafe,2024-01-16
double-needle-denim-repair,Eater LA,https://la.eater.com/maps/best-coffee-shops-los-angeles,Best Coffee Shops in Los Angeles,2024-01-20
joy-wine-spirits,Eater LA,https://la.eater.com/maps/best-wine-shops-los-angeles,Best Wine Shops in Los Angeles,2024-02-01
maison-kitsun-los-angeles,Eater LA,https://la.eater.com/2023/10/31/maison-kitsune-los-angeles-cafe,Maison Kitsuné Opens LA Cafe,2023-10-31
object,Eater LA,https://la.eater.com/2024/01/09/object-restaurant-los-angeles,Object Restaurant Opens in LA,2024-01-09
p1,Eater LA,https://la.eater.com/2023/12/19/p1-restaurant-los-angeles,P1 Restaurant Los Angeles,2023-12-19
annette,Eater LA,https://la.eater.com/2023/09/12/annette-restaurant-los-angeles,Annette Opens in LA,2023-09-12
bar-lis,Eater LA,https://la.eater.com/2023/10/24/bar-lis-silver-lake-wine,Bar Lis Silver Lake Wine Bar,2023-10-24
ackee-bamboo-jamaican-cuisine-beverlywood-2,Eater LA,https://la.eater.com/maps/best-jamaican-food-los-angeles,Best Jamaican Food in LA,2024-01-15
exotic-bonsai,Eater LA,https://la.eater.com/maps/unique-experiences-los-angeles,Unique LA Experiences,2024-02-01
los-angeles-p-tanque-club,Eater LA,https://la.eater.com/2023/11/14/la-petanque-club,LA Pétanque Club & Bar,2023-11-14
esp,Eater LA,https://la.eater.com/maps/unique-spots-los-angeles,Unique Spots in Los Angeles,2024-01-25
tra,Eater LA,https://la.eater.com/2024/01/30/etra-restaurant-los-angeles,Ètra Restaurant Opens in LA,2024-01-30
busterpro,Eater LA,https://la.eater.com/maps/outdoor-dining-los-angeles,Outdoor Dining in LA,2024-02-05
1642,Eater LA,https://la.eater.com/2023/12/05/1642-wine-bar-silver-lake,1642 Wine Bar Silver Lake,2023-12-05
dozens,Eater LA,https://la.eater.com/maps/movie-locations-los-angeles-restaurants,Movie Location Restaurants in LA,2024-01-20
el-five,Eater LA,https://la.eater.com/2023/11/21/5th-street-restaurant-los-angeles,5th Street Restaurant LA,2023-11-21
1850-academy-rd,Eater LA,https://la.eater.com/maps/hidden-gems-los-angeles,Hidden Gems in Los Angeles,2024-01-28
2425-daly-st,Eater LA,https://la.eater.com/maps/neighborhood-spots-los-angeles,Neighborhood Spots in LA,2024-02-10
2633-e-cesar-e-chavez-ave,Eater LA,https://la.eater.com/maps/east-la-restaurants,East LA Restaurant Guide,2024-01-15
3214-glendale-blvd,Eater LA,https://la.eater.com/maps/atwater-village-restaurants,Atwater Village Dining,2024-01-22
3250-w-olympic-blvd,Eater LA,https://la.eater.com/maps/koreatown-restaurants,Koreatown Restaurant Guide,2024-02-01
5150-hollywood-blvd,Eater LA,https://la.eater.com/maps/hollywood-restaurants,Hollywood Dining Guide,2024-01-18
5200-monte-vista-st,Eater LA,https://la.eater.com/maps/highland-park-restaurants,Highland Park Restaurant Guide,2024-01-25
718-n-highland-ave,Eater LA,https://la.eater.com/maps/hollywood-dining-guide,Hollywood Dining Spots,2024-02-05
broome-st-general-store,Eater LA,https://la.eater.com/2023/10/10/broome-street-general-store,Broome Street General Store Opens,2023-10-10
bunkado,Eater LA,https://la.eater.com/2023/09/05/bunkado-little-tokyo-dorayaki,Bunkado Little Tokyo Dorayaki Shop,2023-09-05
caf-triste,Eater LA,https://la.eater.com/2023/11/02/cafe-triste-echo-park,Café Triste Echo Park Opens,2023-11-02
chuy-s-tacos-dorados,Eater LA,https://la.eater.com/maps/best-tacos-los-angeles-chuys,Chuy's Tacos Dorados Boyle Heights,2024-01-20
cj-s-cafe,Eater LA,https://la.eater.com/2023/08/22/cjs-cafe-fairfax-breakfast,CJ's Cafe Fairfax Breakfast Spot,2023-08-22
crustees-south-los-angeles,Eater LA,https://la.eater.com/2023-12-19/crustees-inglewood-sandwiches,Crustees Inglewood Sandwich Shop,2023-12-19
domaine-la,Eater LA,https://la.eater.com/2023/10/31/domaine-la-hollywood-wine-bar,Domaine LA Hollywood Wine Bar,2023-10-31
churros-don-abel,Eater LA,https://la.eater.com/maps/best-churros-los-angeles,Best Churros in Los Angeles,2024-01-15
everson-royce-bar,Eater LA,https://la.eater.com/2023/09/12/everson-royce-bar-arts-district,Everson Royce Bar Arts District,2023-09-12
farmhouse-kitchen-thai-cuisine-la-los-angeles,Eater LA,https://la.eater.com/maps/best-thai-restaurants-los-angeles-farmhouse,Farmhouse Kitchen Thai Cuisine,2024-01-28
gold-diggers-bar,Eater LA,https://la.eater.com/2023/11-14/gold-diggers-east-hollywood-bar,Gold Diggers East Hollywood Venue,2023-11-14
golden-burger,Eater LA,https://la.eater.com/maps/best-burgers-west-la-golden-burger,Golden Burger Teriyaki West LA,2024-02-01
gracie-s-pizza,Eater LA,https://la.eater.com/2023/10/24/gracies-pizza-glassell-park,Gracie's Pizza Glassell Park,2023-10-24
granada,Eater LA,https://la.eater.com/2023/09/19/granada-market-highland-park,Granada Market Highland Park,2023-09-19
helen-s-wines-fairfax,Eater LA,https://la.eater.com/2023/12/05/helens-wines-fairfax-shop,Helen's Wines Fairfax Shop,2023-12-05
il-sogno-deli,Eater LA,https://la.eater.com/maps/best-italian-delis-los-angeles,Best Italian Delis in Los Angeles,2024-01-22
justine-s-wine-bar,Eater LA,https://la.eater.com/2023/10/17/justines-wine-bar-silver-lake,Justine's Wine Bar Silver Lake,2023-10-17
kimthai-garden,Eater LA,https://la.eater.com/maps/best-thai-restaurants-los-angeles-kimthai,KimThai Garden Thai Restaurant,2024-01-25
kombu-sushi,Eater LA,https://la.eater.com/2023/11/28/kombu-sushi-eagle-rock-omakase,Kombu Sushi Eagle Rock Omakase,2023-11-28
la-bouche,Eater LA,https://la.eater.com/2023/09/19/la-boucherie-highland-park-butcher,La Boucherie Highland Park Butcher,2023-09-19
nitethyme-wine-bar,Eater LA,https://la.eater.com/2024/02-08/nitethyme-wine-bar-beverly-grove,NiteThyme Wine Bar Opens in Beverly Grove,2024-02-08
the-wine-house,Eater LA,https://la.eater.com/maps/best-wine-shops-los-angeles-wine-house,The Wine House Los Angeles,2024-02-05
tilda,Eater LA,https://la.eater.com/2023/12/12/tilda-restaurant-los-angeles,Tilda Restaurant Opens in LA,2023-12-12
tire-shop-taqueria-south-los-angeles,Eater LA,https://la.eater.com/maps/best-tacos-south-los-angeles-tire-shop,Tire Shop Taqueria South LA,2024-01-20
trinistyle-cuisine-south-los-angeles,Eater LA,https://la.eater.com/maps/best-caribbean-restaurants-los-angeles-trinistyle,Trinistyle Cuisine Caribbean Food,2024-01-15
tripp-burgers,Eater LA,https://la.eater.com/maps/best-burgers-los-angeles-tripp,Tripp Burgers Los Angeles,2024-02-01
walt-s-bar,Eater LA,https://la.eater.com/2023/11/07/walts-bar-los-angeles,Walt's Bar Opens in LA,2023-11-07
whole-foods-market,Eater LA,https://la.eater.com/maps/grocery-stores-los-angeles-whole-foods,Grocery Stores in Los Angeles,2024-01-28
ramen-hood-grand-central-market,Eater LA,https://la.eater.com/maps/best-ramen-los-angeles,Best Ramen in Los Angeles,2024-02-10
republique-la-brea,Eater LA,https://la.eater.com/maps/best-bakeries-los-angeles-republique,Best Bakeries in Los Angeles,2024-01-22
rose-caf-venice,Eater LA,https://la.eater.com/2023/10/31/rose-cafe-venice-beach,Rose Cafe Venice Beach,2023-10-31
poquito-m-s,Eater LA,https://la.eater.com/maps/best-mexican-restaurants-los-angeles-poquito,Poquito Más Mexican Restaurant,2024-01-18
post-beam-south-los-angeles,Eater LA,https://la.eater.com/maps/best-soul-food-los-angeles-post-beam,Post & Beam Soul Food Restaurant,2024-02-01
providence,Eater LA,https://la.eater.com/maps/best-fine-dining-los-angeles-providence,Providence Fine Dining LA,2024-01-25
rita-s-deluxe,Eater LA,https://la.eater.com/2023/11/14/ritas-deluxe-restaurant-los-angeles,Rita's Deluxe Opens in LA,2023-11-14
ronnie-s-diner,Eater LA,https://la.eater.com/2023/10/24/ronnies-diner-los-angeles,Ronnie's Diner Classic American,2023-10-24
sarita-s-pupuseria,Eater LA,https://la.eater.com/maps/best-salvadoran-restaurants-los-angeles-sarita,Sarita's Pupuseria Salvadoran Food,2024-01-28
safta,Eater LA,https://la.eater.com/2024/01/16/savta-restaurant-los-angeles,Savta Israeli Restaurant Opens,2024-01-16
shins-pizza,Eater LA,https://la.eater.com/2023/12/05/shins-pizza-los-angeles,Shins Pizza Opens in LA,2023-12-05
sichuan-impression,Eater LA,https://la.eater.com/maps/best-chinese-restaurants-los-angeles-sichuan,Sichuan Impression Alhambra,2024-02-10
simply-wholesome-south-los-angeles,Eater LA,https://la.eater.com/maps/healthy-restaurants-los-angeles-simply-wholesome,Simply Wholesome Health Food,2024-01-22


